claim_id,company,ticker,call_date,fiscal_period,claim_type,speaker_name,verbatim_quote,summary,horizon_raw,horizon_end_date,verdict,grader,reasoning
KO_20231024_490095e7,The Coca-Cola Company,KO,2023-10-24,Q3 2023,numerical_guidance,John Murphy,We continue to expect to generate approximately $9.5 billion of free cash flow in 2023,Management expects to generate approximately $9.5 billion of free cash flow in 2023.,2023,2023-12-31,verified,autochecker,"Free cash flow is computed as operating cash flow minus capital expenditures. The post-call Q4 2023 contribution was $2,670M - $851M = $1,819M. Combining this with the pre-call 2023 quarters shown in the panel gives full-year 2023 FCF of (160-276) + (4469-339) + (4300-386) + (2670-851) = $9,747M, or about $9.75B. Management claimed approximately $9.5B, so the realised value was about $0.25B higher, a 2.6% difference, within reasonable tolerance."
KO_20231024_5afccf81,The Coca-Cola Company,KO,2023-10-24,Q3 2023,numerical_guidance,John Murphy,approximately $11.4 billion in cash from operations,Management expects approximately $11.4 billion in cash from operations in 2023.,2023,2023-12-31,verified,autochecker,"The post-call realised Q4 2023 operating cash flow was $2.670B. Adding this to the already reported 2023 Q1-Q3 operating cash flow amounts ($0.160B + $4.469B + $4.300B) gives full-year 2023 cash from operations of $11.599B. Management claimed approximately $11.4B, so the realised amount was higher by $0.199B, about 1.7%, within reasonable tolerance for 'approximately.'"
KO_20240213_ab4e0519,The Coca-Cola Company,KO,2024-02-13,Q4 2023,capital_allocation,John Murphy,less approximately $2.2 billion in capital investments,Management expects approximately $2.2 billion in capital investments in 2024.,in 2024,2024-12-31,verified,autochecker,"Management claimed approximately $2.2 billion in 2024 capital investments. Realised 2024 capx_q summed to $2,064 million ($370M + $422M + $469M + $803M), or $2.064 billion. This is $136 million below the claim, about 6.2% lower, which is within a reasonable ~10% tolerance for an approximate magnitude."
KO_20240213_14463736,The Coca-Cola Company,KO,2024-02-13,Q4 2023,capital_allocation,John Murphy,A significant portion of our expected capital investment increase is to build capacity for fairlife and for our India business,Management expects a significant portion of its capital investment increase to build capacity for fairlife and the India business.,2024,2024-12-31,partially_verified,autochecker,"Total post-call FY2024 capital expenditures were 370 + 422 + 469 + 803 = $2,064M. The comparable FY2023 baseline was 276 + 339 + 386 + 851 = $1,852M, so realised capital investment increased by $212M, or about 11.4% year over year. This supports the direction of an expected capital investment increase. However, Compustat capx_q only shows total capital expenditures and does not identify whether a significant portion was specifically for fairlife or India capacity, so the allocation part cannot be directly verified from these fundamentals."
KO_20240213_58d0bcf9,The Coca-Cola Company,KO,2024-02-13,Q4 2023,capital_allocation,John Murphy,We've taken up our CapEx for 2024 because it's the right thing to do to continue to build the growth foundations that we need in those parts of the business that need capacity.,Management has increased 2024 CapEx to build growth foundations in areas needing capacity.,2024,2024-12-31,verified,autochecker,"The claim was directional: management said 2024 CapEx had been increased. Realised 2024 quarterly CapEx was $370M, $422M, $469M, and $803M, totaling $2,064M. The 2023 baseline quarters totaled $1,852M, so 2024 CapEx increased by $212M, or about 11.4%. This matches the claimed direction of higher CapEx."
KO_20240213_aa128976,The Coca-Cola Company,KO,2024-02-13,Q4 2023,numerical_guidance,John Murphy,comparable currency-neutral earnings per share growth of 8% to 10%,Management expects 2024 comparable currency-neutral earnings per share growth of 8% to 10%.,2024,2024-12-31,contradicted,autochecker,"Using Compustat diluted EPS excluding extraordinary items (epsfxq), 2024 EPS sums to 0.7 + 0.6 + 0.7 + 0.5 = $2.50. The 2023 baseline EPS also sums to $2.50, so realised EPS growth was (2.50 / 2.50 - 1) = 0.0%. Management guided to 8% to 10% comparable currency-neutral EPS growth. The realised Compustat EPS growth is flat, well below the guided positive growth range."
KO_20240213_69653516,The Coca-Cola Company,KO,2024-02-13,Q4 2023,numerical_guidance,John Murphy,we expect comparable earnings per share growth of 4% to 5% versus $2.69 in 2023,Management expects 2024 comparable earnings per share growth of 4% to 5% versus $2.69 in 2023.,2024,2024-12-31,contradicted,autochecker,"Management guided to 2024 comparable EPS growth of 4% to 5% versus $2.69, implying about $2.80 to $2.82 for 2024. The post-call Compustat diluted EPS values sum to $2.50 for 2024 (0.70 + 0.60 + 0.70 + 0.50). Versus the stated $2.69 baseline, this is growth of (2.50 / 2.69 - 1) = -7.1%, not +4% to +5%. Even versus the Compustat 2023 quarterly EPS sum of $2.50, realised growth would be 0%. The realised EPS growth is therefore clearly below and directionally inconsistent with the guidance range in the available Compustat field."
KO_20240213_9bb07109,The Coca-Cola Company,KO,2024-02-13,Q4 2023,numerical_guidance,John Murphy,We expect to generate approximately $9.2 billion of free cash flow in 2024,Management expects to generate approximately $9.2 billion of free cash flow in 2024.,in 2024,2024-12-31,contradicted,autochecker,"Free cash flow is assessed as operating cash flow minus capital expenditures. For 2024, operating cash flow summed to $6,805M (528 + 3,585 - 1,259 + 3,951) and capex summed to $2,064M (370 + 422 + 469 + 803), giving realised free cash flow of $4,741M, or about $4.7B. Management's claim was approximately $9.2B. The realised amount was about 48% below the claim, well outside the tolerance and clearly short of the stated magnitude."
KO_20240213_50f088c0,The Coca-Cola Company,KO,2024-02-13,Q4 2023,numerical_guidance,John Murphy,through approximately $11.4 billion in cash from operations,Management expects approximately $11.4 billion in cash from operations in 2024.,in 2024,2024-12-31,contradicted,autochecker,"Management guided to approximately $11.4 billion of cash from operations in 2024. Summing the post-call quarterly operating cash flow values for fiscal 2024 gives $6,805 million: 528 + 3,585 - 1,259 + 3,951 = 6,805, or $6.805 billion. This is about 40% below the claimed $11.4 billion, well outside a reasonable tolerance and off by a clear margin."
KO_20240213_25a52405,The Coca-Cola Company,KO,2024-02-13,Q4 2023,numerical_guidance,James Quincey,the mid-single-digit U.S. dollar EPS call for 2024 includes the disposal of 2 points of EPS from the bottling system,Management says the 2024 U.S. dollar EPS outlook includes a 2-point EPS impact from bottler disposals.,2024,2024-12-31,contradicted,autochecker,"Using diluted EPS excluding extraordinary items, realised 2024 EPS was $0.70 + $0.60 + $0.70 + $0.50 = $2.50. The 2023 base-year EPS was also $2.50, so realised U.S. dollar EPS growth was 0.0%. A 'mid-single-digit' EPS outlook implies roughly +4% to +6% growth, even after the stated 2-point bottling-disposal impact. The realised aggregate EPS growth therefore did not match the claimed mid-single-digit EPS outcome. The Compustat EPS data also do not separately identify the bottler-disposal component, but the observable total EPS growth was clearly below guidance."
KO_20240213_16ddf560,The Coca-Cola Company,KO,2024-02-13,Q4 2023,numerical_guidance,James Quincey,"So kind of on an ongoing basis, that's already 6% to 7%.",Management says the ongoing-basis EPS growth outlook is 6% to 7%.,2024,2024-12-31,contradicted,autochecker,"Using diluted EPS excluding extraordinary items, realised FY2024 EPS was 0.7 + 0.6 + 0.7 + 0.5 = 2.5. The FY2023 baseline was also 0.7 + 0.6 + 0.7 + 0.5 = 2.5, so realised EPS growth was 0.0%. Management's outlook was 6% to 7% growth. The realised growth was not positive and is well below the guided range."
KO_20240430_d324d6d4,The Coca-Cola Company,KO,2024-04-30,Q1 2024,numerical_guidance,John Murphy,comparable currency-neutral earnings per share growth of 11% to 13%,Management expects 2024 comparable currency-neutral earnings per share growth of 11% to 13%.,2024,2024-12-31,not_yet_resolvable,autochecker,"The claim is for full-year 2024 comparable currency-neutral EPS growth of 11% to 13%. The post-call epsfxq values available for Q2-Q4 2024 sum to 1.8, and adding the pre-call Q1 2024 epsfxq of 0.7 gives FY2024 reported diluted EPS excluding extraordinary items of 2.5. However, the panel does not include 2023 Q1 epsfxq, so the full-year 2023 baseline needed to compute FY2024 growth is missing. The available Q2-Q4 comparison would be 1.8 in 2024 versus 1.8 in 2023, or 0% growth, but that is not the full-year growth horizon stated in the claim. Also, Compustat epsfxq is not currency-neutral comparable EPS."
KO_20240430_0805ba8a,The Coca-Cola Company,KO,2024-04-30,Q1 2024,numerical_guidance,John Murphy,"All in, we continue to expect comparable earnings per share growth of 4% to 5% versus $2.69 in 2023.",Management expects comparable earnings per share growth of 4% to 5% versus $2.69 in 2023.,2024,2024-12-31,contradicted,autochecker,"The guidance implied 2024 comparable EPS of about $2.80-$2.82, calculated as $2.69 × 1.04 to 1.05. Using the provided Compustat diluted EPS values, the post-call quarters Q2-Q4 total $1.80; including the already-reported Q1 2024 EPS of $0.70 from the pre-call/base section gives full-year 2024 EPS of about $2.50. That is a decline of roughly 7.1% versus $2.69, not growth of 4%-5%."
KO_20240723_7f5f393f,The Coca-Cola Company,KO,2024-07-23,Q2 2024,numerical_guidance,John Murphy,We now expect organic revenue growth of 9% to 10%,Management expects 2024 organic revenue growth of 9% to 10%.,2024,2024-12-31,contradicted,autochecker,"Using Compustat reported total revenue as the revenue proxy, post-call revenue for Q3–Q4 2024 was $23,398M ($11,854M + $11,544M). The comparable Q3–Q4 2023 base-period revenue was $22,802M ($11,953M + $10,849M), so realised reported revenue growth was about 2.6% = (23,398 / 22,802 - 1). Management claimed 2024 organic revenue growth of 9% to 10%. The realised Compustat revenue growth proxy is positive but far below the claimed magnitude, outside the reasonable tolerance and more than 25% below the guidance range."
KO_20240723_7ed21107,The Coca-Cola Company,KO,2024-07-23,Q2 2024,numerical_guidance,John Murphy,comparable currency-neutral earnings per share growth of 13% to 15%.,Management expects 2024 comparable currency-neutral EPS growth of 13% to 15%.,2024,2024-12-31,not_yet_resolvable,autochecker,"The claim is for full-year 2024 EPS growth of 13% to 15%. The post-call Compustat rows provide diluted EPS excluding extraordinary items of $0.70 in 2024 Q3 and $0.50 in 2024 Q4, for post-call H2 EPS of $1.20. The available same-quarter 2023 baseline in the pre-call panel is also $0.70 for Q3 and $0.50 for Q4, implying 0.0% H2 year-over-year growth on this Compustat EPS measure, not 13% to 15%. However, the actual claim is full-year 2024 growth, and the panel does not include 2023 Q1 and Q2 EPS needed to compute a full-year 2024 vs full-year 2023 realised growth rate. Therefore the full-year claim cannot be definitively resolved from the provided panel."
KO_20240723_ab9a7859,The Coca-Cola Company,KO,2024-07-23,Q2 2024,numerical_guidance,John Murphy,"All in, we now expect comparable earnings per share growth of 5% to 6% versus $2.69 in 2023.",Management expects comparable EPS growth of 5% to 6% in 2024 versus $2.69 in 2023.,2024,2024-12-31,contradicted,autochecker,"The post-call EPS values were $0.70 in Q3 2024 and $0.50 in Q4 2024. Adding these to the already-known pre-call 2024 Q1 and Q2 EPS of $0.70 and $0.60 gives realised FY2024 diluted EPS of $2.50. Versus the stated 2023 base of $2.69, this is growth of (2.50 / 2.69 - 1) = -7.1%, while management guided to +5% to +6% growth, equivalent to about $2.82 to $2.85 EPS. The realised Compustat EPS moved in the opposite direction from the claim."
KO_20241023_47cde64a,The Coca-Cola Company,KO,2024-10-23,Q3 2024,numerical_guidance,John Murphy,comparable currency-neutral earnings per share growth of 14% to 15%,Management expects 2024 comparable currency-neutral earnings per share growth of 14% to 15%.,2024,2024-12-31,not_yet_resolvable,autochecker,"The only post-call Compustat EPS evidence within the horizon is 2024 Q4 diluted EPS excluding extraordinary items of $0.50. To verify management's stated 2024 comparable currency-neutral EPS growth of 14% to 15%, we would need a full-year 2024 EPS measure and the comparable full-year 2023 baseline, ideally on the same comparable currency-neutral basis. The panel provides 2024 quarterly epsfxq values, but it does not provide 2023 Q1-Q3 EPS needed to compute full-year 2023 growth, and Compustat epsfxq is not currency-neutral comparable EPS. Therefore the realised growth rate cannot be computed from the supplied panel."
KO_20241023_5d7647dd,The Coca-Cola Company,KO,2024-10-23,Q3 2024,numerical_guidance,John Murphy,We continue to expect comparable earnings per share growth of 5% to 6% versus $2.69 in 2023.,Management expects comparable earnings per share growth of 5% to 6% versus $2.69 in 2023.,full year 2024,2024-12-31,contradicted,autochecker,"The claim implied full-year 2024 comparable EPS of $2.69 × (1.05 to 1.06) = about $2.82 to $2.85. Compustat diluted EPS excluding extraordinary items for the post-call Q4 was $0.50; adding the already-reported 2024 Q1-Q3 EPS from the base period ($0.70 + $0.60 + $0.70) gives realised FY2024 epsfxq of $2.50. That is about -7.1% versus $2.69, not +5% to +6%, and is roughly 12% below the midpoint of the guided range."
KO_20250211_5dc717ed,The Coca-Cola Company,KO,2025-02-11,Q4 2024,capital_allocation,John Murphy,approximately $2.2 billion in capital investments.,Management expects approximately $2.2 billion in capital investments in 2025.,2025,2025-12-31,verified,autochecker,"Management claimed approximately $2.2 billion in 2025 capital investments. Realized 2025 capital expenditures were $309M + $442M + $479M + $882M = $2,112M, or $2.112 billion. This is about 4.0% below the claimed $2.2 billion, within a reasonable tolerance for an approximate forecast."
KO_20250211_9a8041f4,The Coca-Cola Company,KO,2025-02-11,Q4 2024,numerical_guidance,John Murphy,We expect organic revenue growth of 5% to 6%,Management expects organic revenue growth of 5% to 6% in 2025.,2025,2025-12-31,contradicted,autochecker,"Using Compustat total revenue (revtq) as the available proxy, 2025 revenue was $47,941M (11,129 + 12,535 + 12,455 + 11,822). The 2024 base-period revenue was $47,061M, so realised 2025 revenue growth was about 1.9% YoY. Management claimed 5% to 6% organic revenue growth. The realised Compustat revenue growth is positive but far below the guided range, with a shortfall of more than 25% relative to the low end of guidance. Note that Compustat revtq is total revenue, not organic revenue, but on the available fundamentals the numerical claim is not met."
KO_20250211_329df00c,The Coca-Cola Company,KO,2025-02-11,Q4 2024,numerical_guidance,John Murphy,comparable currency-neutral earnings per share growth of 8% to 10%,Management expects comparable currency-neutral earnings per share growth of 8% to 10% in 2025.,2025,2025-12-31,contradicted,autochecker,"Using Compustat diluted EPS excl. extraordinary items (epsfxq), realised FY2025 EPS was 0.8 + 0.9 + 0.9 + 0.5 = 3.1 per share. The FY2024 baseline from the pre-call quarters was 0.7 + 0.6 + 0.7 + 0.5 = 2.5 per share. This implies realised EPS growth of (3.1 / 2.5 - 1) = 24.0%, versus management's stated 8% to 10% growth range. The realised Compustat EPS growth is well above the guided range by a clear margin."
KO_20250211_bdf2bf99,The Coca-Cola Company,KO,2025-02-11,Q4 2024,numerical_guidance,John Murphy,we expect comparable earnings per share growth of 2% to 3%,Management expects comparable earnings per share growth of 2% to 3% in 2025.,2025,2025-12-31,contradicted,autochecker,"Using diluted EPS (epsfxq), realised 2025 EPS was 0.8 + 0.9 + 0.9 + 0.5 = 3.1. The 2024 baseline EPS from the pre-call quarters was 0.7 + 0.6 + 0.7 + 0.5 = 2.5. Realised growth was (3.1 / 2.5 - 1) = 24.0%, versus management's expected 2% to 3% growth. This is far above the guided range and off by more than 25% relative to the claimed magnitude."
KO_20250211_ffab26ec,The Coca-Cola Company,KO,2025-02-11,Q4 2024,numerical_guidance,John Murphy,approximately $11.7 billion in cash from operations,Management expects approximately $11.7 billion in cash from operations in 2025.,2025,2025-12-31,contradicted,autochecker,"Management guided to approximately $11.7 billion of 2025 cash from operations. Summing the post-call 2025 quarterly operating cash flow values gives -$5,202M + $3,811M + $5,043M + $3,756M = $7,408M, or $7.408 billion. This is about $4.292 billion below the $11.7 billion claim, a shortfall of roughly 36.7% relative to guidance, which is well outside the reasonable tolerance and more than a clear 25% margin."
KO_20250429_d347202c,The Coca-Cola Company,KO,2025-04-29,Q1 2025,numerical_guidance,John Murphy,now expect comparable currency-neutral earnings per share growth of 7% to 9%,Management expects 2025 comparable currency-neutral earnings per share growth of 7% to 9%.,2025,2025-12-31,not_yet_resolvable,autochecker,"The post-call EPS values available for the remainder of 2025 are Q2-Q4 diluted EPS of 0.9, 0.9, and 0.5, totaling 2.3, and the same for basic EPS. Including the pre-call 2025 Q1 value shown in the panel would give full-year 2025 EPS of 3.1. However, the claim is for full-year 2025 EPS growth of 7% to 9% versus 2024, and the panel does not include 2024 Q1 EPS, so full-year 2024 EPS cannot be computed from the provided data. In addition, Compustat EPS is not specifically 'comparable currency-neutral' EPS. Therefore the realised growth rate cannot be resolved from the supplied panel."
KO_20250429_2f80afa0,The Coca-Cola Company,KO,2025-04-29,Q1 2025,numerical_guidance,John Murphy,we continue to expect 2025 comparable earnings per share growth of 2% to 3% versus $2.88 in 2024,Management expects 2025 comparable earnings per share growth of 2% to 3% versus $2.88 in 2024.,2025,2025-12-31,contradicted,autochecker,"Management guided to 2025 EPS of $2.94-$2.97, i.e. 2%-3% growth versus $2.88. The post-call EPSFXQ values for Q2-Q4 2025 sum to $2.30; including the already-reported Q1 2025 EPSFXQ of $0.80 from the pre-call base gives full-year 2025 EPSFXQ of $3.10. That is growth of about 7.6% versus $2.88, well above the guided 2%-3% range and outside a reasonable tolerance. Note this uses Compustat EPSFXQ as the available proxy for management’s “comparable EPS.”"
KO_20250722_2238faca,The Coca-Cola Company,KO,2025-07-22,Q2 2025,numerical_guidance,John Murphy,We continue to expect organic revenue growth of 5% to 6%,Management expects 2025 organic revenue growth of 5% to 6%.,2025,2025-12-31,partially_verified,autochecker,"Using Compustat total revenue as the available proxy for organic revenue, post-call Q3 2025 revenue was $12,455M versus $11,854M in Q3 2024, a +5.1% YoY increase. Q4 2025 revenue was $11,822M versus $11,544M in Q4 2024, a +2.4% YoY increase. Combined post-call H2 2025 revenue was $24,277M versus $23,398M in H2 2024, or +3.8%. Management guided to 5%-6% organic revenue growth, so realised reported revenue growth was directionally positive but below the guided range, about 1.2 percentage points below the low end."
KO_20250722_149bfcbe,The Coca-Cola Company,KO,2025-07-22,Q2 2025,numerical_guidance,John Murphy,now expect comparable currency-neutral earnings per share growth of approximately 8%,Management expects 2025 comparable currency-neutral earnings per share growth of approximately 8%.,2025,2025-12-31,not_yet_resolvable,autochecker,"The post-call horizon has closed and the relevant post-call diluted EPS values are present: Q3 2025 epsfxq = $0.90 and Q4 2025 epsfxq = $0.50. However, the claim is for full-year 2025 EPS growth of approximately 8%, which requires comparing full-year 2025 EPS to full-year 2024 EPS. The panel provides 2025 Q1-Q4, but the 2024 baseline only includes Q3 and Q4; 2024 Q1 and Q2 EPS are missing, so full-year 2024 EPS growth cannot be computed from the provided data. Also, Compustat epsfxq is not explicitly “comparable currency-neutral” EPS."
KO_20250722_8c03d5c0,The Coca-Cola Company,KO,2025-07-22,Q2 2025,numerical_guidance,John Murphy,Our underlying effective tax rate for 2025 is still expected to be 20.8%,Management expects the 2025 underlying effective tax rate to be 20.8%.,2025,2025-12-31,partially_verified,autochecker,"Using Compustat tax expense and pretax income for FY2025, the realised effective tax rate was (722 + 993 + 500 + 646) / (4057 + 4796 + 4183 + 2962) = 2861 / 15998 = 17.9%. The post-call quarters cited contributed Q3 tax/pretax of 500/4183 and Q4 of 646/2962. Management’s claim was 20.8%, so the realised Compustat ETR was about 2.9 percentage points lower, a roughly 14% relative shortfall versus the claimed rate. That is outside the ~10% magnitude tolerance, though not off by more than 25%."
KO_20250722_d7e71239,The Coca-Cola Company,KO,2025-07-22,Q2 2025,numerical_guidance,John Murphy,we now expect 2025 comparable earnings per share growth of approximately 3% versus $2.88 in 2024,Management expects 2025 comparable earnings per share growth of approximately 3% versus $2.88 in 2024.,2025,2025-12-31,contradicted,autochecker,"Using Compustat diluted EPS excluding extraordinary items (epsfxq), post-call EPS was 0.90 in Q3 2025 and 0.50 in Q4 2025. Including the already-reported pre-call 2025 quarters from the panel (Q1 0.80 and Q2 0.90), full-year 2025 epsfxq sums to 3.10. Versus the stated 2024 base of $2.88, realised growth was (3.10 / 2.88 - 1) = 7.6%. The claim was approximately 3% growth, so the realised growth was positive but far above the guided magnitude, off by about 4.6 percentage points and more than 25% relative to the claim."
KO_20251021_ad134056,The Coca-Cola Company,KO,2025-10-21,Q3 2025,numerical_guidance,John Murphy,We continue to expect organic revenue growth of 5% to 6%,Management expects 2025 organic revenue growth of 5% to 6%.,2025,2025-12-31,not_yet_resolvable,autochecker,"The post-call Compustat row shows Q4 2025 reported revenue/sales of $11,822M. However, the claim is for full-year 2025 organic revenue growth of 5% to 6%. Compustat provides reported revenue/sales, not organic revenue, and the panel does not include the 2024 Q1-Q3 revenue rows needed to compute full-year 2025 reported revenue growth versus full-year 2024. A Q4-only reported revenue comparison to the available 2024-12-31 baseline would be +2.4% (($11,822M - $11,544M) / $11,544M), but that is not the same as full-year organic revenue growth."
KO_20251021_67ece5d7,The Coca-Cola Company,KO,2025-10-21,Q3 2025,numerical_guidance,John Murphy,expect comparable currency-neutral earnings per share growth of approximately 8%,Management expects 2025 comparable currency-neutral earnings per share growth of approximately 8%.,2025,2025-12-31,not_yet_resolvable,autochecker,"The claim is for full-year 2025 comparable currency-neutral EPS growth of approximately 8%. The post-call panel contains only 2025 Q4 diluted EPS excluding extraordinary items of $0.50/share. To compute realised full-year EPS growth, we would need full-year 2025 EPS and the comparable full-year 2024 EPS baseline. The panel provides 2025 Q1-Q3 in the pre-call base and 2025 Q4 post-call, but it does not provide 2024 Q1-Q3, so the full-year 2024 denominator is missing. Therefore the realised 2025 EPS growth rate cannot be calculated from the provided Compustat rows."
KO_20251021_80939478,The Coca-Cola Company,KO,2025-10-21,Q3 2025,numerical_guidance,John Murphy,Our underlying effective tax rate for 2025 is now expected to be 20.7%.,Management expects the underlying effective tax rate for 2025 to be 20.7%.,2025,2025-12-31,partially_verified,autochecker,"Using Compustat tax expense divided by pretax income as the effective tax rate, Q4 2025 realised ETR was 646.0 / 2962.0 = 21.8%. For the full fiscal year 2025, including the pre-call Q1-Q3 actuals shown in the panel, realised ETR was (722.0 + 993.0 + 500.0 + 646.0) / (4057.0 + 4796.0 + 4183.0 + 2962.0) = 2861.0 / 15998.0 = 17.9%. This is below the claimed 20.7% by about 2.8 percentage points, or roughly 13.6% relative, which is outside the ~10% tolerance but not a clear >25% miss."
KO_20251021_5751d9bf,The Coca-Cola Company,KO,2025-10-21,Q3 2025,numerical_guidance,John Murphy,we continue to expect 2025 comparable earnings per share growth of approximately 3% versus $2.88 in 2024.,Management expects 2025 comparable earnings per share growth of approximately 3% versus $2.88 in 2024.,2025,2025-12-31,verified,autochecker,"The claim implies 2025 EPS of about $2.88 * 1.03 = $2.97. Using Compustat diluted EPS excluding extraordinary items, the post-call Q4 2025 EPS was $0.50; adding the already-reported 2025 Q1-Q3 EPS from the base period ($0.80 + $0.90 + $0.90) gives realised full-year 2025 EPS of $3.10. That is about 7.6% growth versus $2.88 and is 4.5% above the claimed approximately $2.97 level, within the ~10% tolerance for numerical guidance. Note this uses Compustat epsfxq, not the company’s non-GAAP “comparable” EPS measure."
