claim_id,company,ticker,call_date,fiscal_period,claim_type,speaker_name,verbatim_quote,summary,horizon_raw,horizon_end_date,verdict,grader,reasoning
KO_20200130_44410b62,The Coca-Cola Company,KO,2020-01-30,Q4 2019,capital_allocation,John Murphy,$2 billion in capital investments,Management expects $2 billion in capital investments in 2020.,2020,2020-12-31,contradicted,autochecker,"Management claimed $2.0 billion in capital investments for 2020. Realized 2020 quarterly capital expenditures were $327M + $209M + $223M + $418M = $1,177M, or $1.177 billion. This is about $823M below the claim, a shortfall of roughly 41% relative to the stated $2.0B, which is well outside the reasonable tolerance and more than 25% off."
KO_20200130_59d7b91c,The Coca-Cola Company,KO,2020-01-30,Q4 2019,numerical_guidance,John Murphy,we expect organic growth -- organic revenue growth of approximately 5%,Management expects organic revenue growth of approximately 5% in 2020.,2020,2020-12-31,contradicted,autochecker,"Using Compustat reported total revenue as the available proxy for revenue growth, 2020 full-year revenue was 8,601 + 7,150 + 8,652 + 8,611 = $33,014M. The 2019 baseline revenue was 8,694 + 9,997 + 9,507 + 9,068 = $37,266M. Realized reported revenue growth was therefore (33,014 / 37,266 - 1) = -11.4%, versus management's claim of approximately +5% organic revenue growth. The realized reported revenue change went in the opposite direction by a wide margin."
KO_20200130_f2d00f6e,The Coca-Cola Company,KO,2020-01-30,Q4 2019,numerical_guidance,John Murphy,comparable currency-neutral operating income growth of approximately 8%,Management expects comparable currency-neutral operating income growth of approximately 8% in 2020.,2020,2020-12-31,contradicted,autochecker,"Using Compustat operating income after D&A (oiadpq) as the available proxy, 2020 operating income summed to $9,837M (2,582 + 2,154 + 2,670 + 2,431). The 2019 base-year sum was $10,541M, so realised 2020 growth was (9,837 - 10,541) / 10,541 = -6.7%. Management claimed approximately +8% comparable currency-neutral operating income growth. The realised Compustat operating income change was negative, opposite the claimed positive growth."
KO_20200130_86a4e5ec,The Coca-Cola Company,KO,2020-01-30,Q4 2019,numerical_guidance,John Murphy,"we expect comparable earnings per share of approximately $2.25 for 2020, a 7% increase from the prior year","Management expects comparable earnings per share of approximately $2.25 in 2020, a 7% increase from the prior year.",2020,2020-12-31,contradicted,autochecker,"Using Compustat diluted EPS excluding extraordinary items (epsfxq), realised 2020 EPS is the sum of the four post-call quarters: 0.6 + 0.4 + 0.4 + 0.3 = $1.70. The claim was approximately $2.25, so realised EPS was $0.55 lower, about 24% below the claimed level. Versus the 2019 baseline sum of 0.4 + 0.6 + 0.6 + 0.5 = $2.10, realised 2020 EPS declined by about 19.0%, whereas management claimed a 7% increase. The direction of the year-over-year change is opposite the claim."
KO_20200130_424ed141,The Coca-Cola Company,KO,2020-01-30,Q4 2019,numerical_guidance,John Murphy,We also expect to generate approximately $8 billion of free cash flow for 2020,Management expects to generate approximately $8 billion of free cash flow in 2020.,2020,2020-12-31,verified,autochecker,"Free cash flow is calculated as operating cash flow minus capital expenditures. For 2020, operating cash flow summed to $9,844M (556 + 2,230 + 3,434 + 3,624) and capex summed to $1,177M (327 + 209 + 223 + 418), giving realised free cash flow of $8,667M, or about $8.7B. Management guided to approximately $8.0B, so the realised value was about 8.3% above the claim, within the ~10% tolerance for an approximate magnitude."
KO_20200130_2edef74f,The Coca-Cola Company,KO,2020-01-30,Q4 2019,numerical_guidance,John Murphy,through $10 billion in cash from operations,Management expects $10 billion in cash from operations in 2020.,2020,2020-12-31,verified,autochecker,"The relevant realised cash from operations is the sum of quarterly oancf_q for fiscal 2020: 556 + 2,230 + 3,434 + 3,624 = 9,844 million, or $9.844 billion. Management’s claim was $10 billion in cash from operations for 2020. The realised amount was about $0.156 billion below the claim, a shortfall of roughly 1.6%, which is within a reasonable tolerance for magnitude guidance."
KO_20200421_0d9d72e0,The Coca-Cola Company,KO,2020-04-21,Q1 2020,numerical_guidance,John Murphy,We still expect the company's underlying effective tax rate to be 19.5% for the year.,Management expects the company’s underlying effective tax rate to be 19.5% for the year.,for the year,2020-12-31,contradicted,autochecker,"For the post-call quarters through the 2020 year-end horizon, reported income tax expense was $1,766M and pretax income was $6,739M, giving a realised effective tax rate of 26.2% (1,766 / 6,739). Management’s claimed underlying effective tax rate was 19.5%. The realised Compustat tax rate is higher by 6.7 percentage points, about 34% above the claimed rate, which is well outside the reasonable tolerance."
KO_20210210_5500e80a,The Coca-Cola Company,KO,2021-02-10,Q4 2020,capital_allocation,John Murphy,we expect capital expenditures of approximately $1.5 billion,Management expects capital expenditures of approximately $1.5 billion in 2021.,2021,2021-12-31,verified,autochecker,"Management claimed 2021 capital expenditures would be approximately $1.5 billion. Realised 2021 capex was 216 + 234 + 278 + 639 = $1,367 million, or $1.367 billion. This is $133 million below the claim, an 8.9% shortfall versus $1.5 billion, which is within the ~10% tolerance for an approximate magnitude."
KO_20210210_90c22528,The Coca-Cola Company,KO,2021-02-10,Q4 2020,numerical_guidance,John Murphy,expect to deliver at least $10 billion in cash from operations,Management expects to deliver at least $10 billion in cash from operations in 2021.,2021,2021-12-31,verified,autochecker,"Management guided to at least $10.0 billion in cash from operations for 2021. Summing post-call 2021 quarterly operating cash flow gives $1.636B + $3.889B + $3.706B + $3.394B = $12.625B. This exceeds the claimed minimum by $2.625B, so the guidance was met."
KO_20210721_e40df893,The Coca-Cola Company,KO,2021-07-21,Q2 2021,numerical_guidance,John Murphy,We now expect to deliver year-over-year organic revenue growth of 12% to 14%,Management expects organic revenue to grow 12% to 14% year over year in 2021.,in 2021,2021-12-31,verified,autochecker,"Using reported revenue/sales as the Compustat proxy for organic revenue, the post-call 2021 quarters totaled $19,506M in revenue/sales ($10,042M + $9,464M). The comparable prior-year quarters in the base period totaled $17,263M ($8,652M + $8,611M). That implies year-over-year growth of 13.0% for the post-call portion of the 2021 horizon, which falls within management's guided 12% to 14% range."
KO_20210721_870d4328,The Coca-Cola Company,KO,2021-07-21,Q2 2021,numerical_guidance,John Murphy,comparable EPS growth of 13% to 15% in 2021,Management expects comparable EPS to grow 13% to 15% in 2021.,in 2021,2021-12-31,not_yet_resolvable,autochecker,"The claim is for full-year 2021 comparable EPS growth of 13% to 15% versus 2020. The post-call evidence shows diluted EPS of $0.60 in Q3 2021 and $0.60 in Q4 2021. Combining these with the pre-call 2021 quarters shown would give 2021 EPS of $2.30, but the panel does not include Q1 2020 or Q2 2020 EPS, so the full-year 2020 baseline needed to calculate 2021 EPS growth is missing. Therefore the realised full-year growth rate cannot be computed from the provided Compustat panel."
KO_20210721_4d916665,The Coca-Cola Company,KO,2021-07-21,Q2 2021,numerical_guidance,John Murphy,our updated guidance for free cash flow of at least $9 billion,Management's updated full-year free cash flow guidance is at least $9 billion.,full year,2021-12-31,verified,autochecker,"Free cash flow is operating cash flow less capital expenditures. In the post-call quarters, Q3 FCF was $3.428B (3706 - 278) and Q4 FCF was $2.755B (3394 - 639), for post-call FCF of $6.183B. The company had already generated $5.075B of FCF in 1H 2021 before the call, so full-year 2021 FCF was $11.258B. This exceeds management's guidance of at least $9.0B by about $2.258B, so the guidance was achieved."
KO_20211027_ffc1deb3,The Coca-Cola Company,KO,2021-10-27,Q3 2021,numerical_guidance,John Murphy,comparable EPS growth of 15% to 17% in 2021,Management expects comparable EPS growth of 15% to 17% in 2021.,2021,2021-12-31,not_yet_resolvable,autochecker,"The post-call panel provides only Q4 2021 diluted EPS ex. extraordinary items of $0.60. The claim is for full-year 2021 comparable EPS growth of 15% to 17%, which requires full-year 2021 EPS and the full-year 2020 baseline. Although 2021 EPS can be partly assembled from the displayed quarters, the needed prior-year full-year EPS baseline is not present in the panel, and the table also contains GAAP epsfxq rather than explicitly 'comparable' EPS. Therefore the realised full-year growth cannot be computed from the supplied Compustat data."
KO_20211027_0e7fd0cc,The Coca-Cola Company,KO,2021-10-27,Q3 2021,numerical_guidance,John Murphy,Our updated guidance for free cash flow of approximately $10.5 billion,Management's updated free cash flow guidance is approximately $10.5 billion for the full year.,full year,2021-12-31,verified,autochecker,"Free cash flow is calculated as operating cash flow less capital expenditures. For Q4 2021, the post-call quarter, realised FCF was $3.394B - $0.639B = $2.755B. Combining this with the already-reported 2021 Q1-Q3 FCF from the panel ($1.420B + $3.655B + $3.428B) gives full-year 2021 FCF of $11.258B. Management guided to approximately $10.5B; the realised value was about $0.758B higher, or 7.2% above guidance, within the ~10% tolerance for an approximate magnitude claim."
KO_20211027_5491d8d4,The Coca-Cola Company,KO,2021-10-27,Q3 2021,numerical_guidance,John Murphy,a 2- to 3-point headwind to earnings for the full year of 2022,Management estimates a 2- to 3-point currency headwind to earnings for full year 2022.,the full year of 2022,2022-12-31,verified,autochecker,"Using Compustat net income as the earnings measure, FY2022 net income was 2781 + 1905 + 2825 + 2031 = $9,542M. The comparable FY2021 net income from the provided quarters was 2245 + 2641 + 2471 + 2414 = $9,771M, so realised earnings changed by (9542 / 9771 - 1) = -2.3%. That is a 2.3-point decline/headwind, within management's claimed 2- to 3-point headwind range. Compustat does not isolate currency effects specifically, so this verifies the earnings magnitude using niq, not the FX attribution."
KO_20220210_2ef73ff7,The Coca-Cola Company,KO,2022-02-10,Q4 2021,capital_allocation,John Murphy,less approximately $1.5 billion in capital investments.,Management expects approximately $1.5 billion in capital investments over 2022.,over 2022,2022-12-31,verified,autochecker,"Management expected approximately $1.5 billion in 2022 capital investments. Realized 2022 capital expenditures were $217M + $270M + $289M + $708M = $1,484M, or $1.484B. This is only about 1.1% below the claimed ~$1.5B, well within a reasonable tolerance."
KO_20220210_ae9821f8,The Coca-Cola Company,KO,2022-02-10,Q4 2021,numerical_guidance,John Murphy,We expect organic revenue growth of approximately 7% to 8%,Management expects 2022 organic revenue growth of approximately 7% to 8%.,2022,2022-12-31,partially_verified,autochecker,"Using Compustat total revenue as the available proxy for the revenue-growth claim, 2022 revenue was $43,004M (10,491 + 11,325 + 11,063 + 10,125) versus 2021 revenue of $38,655M from the base-period quarters. The realised reported revenue growth was therefore (43,004 - 38,655) / 38,655 = 11.3%. Management guided to approximately 7% to 8% organic revenue growth. The realised reported revenue growth was positive, consistent with the direction, but it was materially above the guided range and outside a ~10% tolerance."
KO_20220210_a9fd176c,The Coca-Cola Company,KO,2022-02-10,Q4 2021,numerical_guidance,John Murphy,we expect comparable currency-neutral earnings per share growth of 8% to 10% versus 2021.,Management expects 2022 comparable currency-neutral earnings per share growth of 8% to 10% versus 2021.,2022,2022-12-31,contradicted,autochecker,"Using Compustat diluted EPS excluding extraordinary items (epsfxq), realised 2022 EPS sums to 2.1 (=0.6+0.4+0.6+0.5). The 2021 baseline EPS sums to 2.3 (=0.5+0.6+0.6+0.6). The realised change was (2.1/2.3 - 1) = -8.7%, versus management's expected +8% to +10% growth. This is the opposite direction and well outside tolerance. Note that Compustat epsfxq is not explicitly 'comparable currency-neutral' EPS, but on the available EPS field the claim is not supported."
KO_20220210_2a9aa87e,The Coca-Cola Company,KO,2022-02-10,Q4 2021,numerical_guidance,John Murphy,we estimate an effective tax rate increase from 18.6% in 2021 to 20% for 2022,Management estimates the effective tax rate will increase to 20% for 2022 from 18.6% in 2021.,2022,2022-12-31,contradicted,autochecker,"Using Compustat income tax expense divided by pretax income for FY2022: total txtq = 665 + 384 + 622 + 444 = 2,115; total piq = 3,458 + 2,284 + 3,444 + 2,500 = 11,686. The realised effective tax rate was 2,115 / 11,686 = 18.1%. Management claimed the effective tax rate would increase to 20% in 2022 from 18.6% in 2021. Instead, the realised 2022 rate was below both the claimed 20% level and the stated 18.6% 2021 baseline, so the direction of increase did not hold."
KO_20220210_11091dd0,The Coca-Cola Company,KO,2022-02-10,Q4 2021,numerical_guidance,John Murphy,we expect comparable earnings per share growth of 5% to 6% versus 2021,Management expects comparable earnings per share growth of 5% to 6% versus 2021.,2022,2022-12-31,contradicted,autochecker,"Using diluted EPS excluding extraordinary items (epsfxq), realised 2022 EPS was 0.6 + 0.4 + 0.6 + 0.5 = 2.1. The 2021 baseline from the pre-call quarters was 0.5 + 0.6 + 0.6 + 0.6 = 2.3. Realised growth was (2.1 / 2.3 - 1) = -8.7%, versus management's expected +5% to +6% growth. The realised result went in the opposite direction from the claim."
KO_20220210_1a0724fd,The Coca-Cola Company,KO,2022-02-10,Q4 2021,numerical_guidance,John Murphy,We expect to generate approximately $10.5 billion of free cash flow over 2022,Management expects to generate approximately $10.5 billion of free cash flow over 2022.,over 2022,2022-12-31,verified,autochecker,"Free cash flow is computed as operating cash flow minus capital expenditures. For 2022, operating cash flow summed to $11.018B (623 + 3923 + 3522 + 2950 million) and capex summed to $1.484B (217 + 270 + 289 + 708 million), giving realised free cash flow of $9.534B. Management claimed approximately $10.5B, so the realised value was lower by $0.966B, or about 9.2% relative to the claim, which is within the ~10% tolerance for an approximate magnitude."
KO_20220210_7af0fc9d,The Coca-Cola Company,KO,2022-02-10,Q4 2021,numerical_guidance,John Murphy,through approximately $12 billion in cash from operations,Management expects approximately $12 billion in cash from operations over 2022.,over 2022,2022-12-31,verified,autochecker,"Management guided to approximately $12.0 billion in cash from operations for 2022. Summing the post-call 2022 quarterly operating cash flow values gives $11,018 million, or $11.018 billion ($623M + $3,923M + $3,522M + $2,950M). This is about 8.2% below the claimed $12.0 billion, within the ~10% tolerance for an approximate magnitude claim."
KO_20220425_531fd1c4,The Coca-Cola Company,KO,2022-04-25,Q1 2022,capital_allocation,John Murphy,less approximately $1.5 billion in capital investments,Management expects approximately $1.5 billion in capital investments for 2022.,2022,2022-12-31,verified,autochecker,"The post-call capital expenditures were $270M in Q2, $289M in Q3, and $708M in Q4, totaling $1.267B after the call. Including the already-reported Q1 2022 capex of $217M, full-year 2022 capital investments were $1.484B. This is very close to management's approximately $1.5B expectation, differing by about $16M or 1.1%."
KO_20220425_6a08764e,The Coca-Cola Company,KO,2022-04-25,Q1 2022,capital_allocation,John Murphy,"For 2022, we announced a dividend increase of 5%",Management announced a 5% dividend increase for 2022.,2022,2022-12-31,verified,autochecker,"Using cash dividends paid (dv_q), the post-call 2022 Q2-Q4 total was $5,710M (1904 + 100 + 3706). The comparable 2021 Q2-Q4 base-period total was $5,442M (1813 + 1814 + 1815). That is an increase of $268M, or 4.9%, versus the claimed 5% dividend increase. Although the quarterly timing is uneven, the realised same-period aggregate increase is within reasonable tolerance of the claim."
KO_20220425_017c811d,The Coca-Cola Company,KO,2022-04-25,Q1 2022,capital_allocation,John Murphy,we also announced the resumption of share repurchases with approximately $500 million in net share repurchases expected this year,Management expects approximately $500 million in net share repurchases this year.,this year,2022-12-31,verified,autochecker,"Net share repurchases over the post-call remainder of 2022 equal share repurchases less stock issuance: Q2-Q4 prstkc_q sum = 664 + 202 + 6 = $872M, and Q2-Q4 sstk_q sum = 203 + 55 + 130 = $388M. Realised net share repurchases = $872M - $388M = $484M, versus management's expectation of approximately $500M. The realised amount is about 3.2% below the claim, within a reasonable tolerance."
KO_20220425_1d46c442,The Coca-Cola Company,KO,2022-04-25,Q1 2022,numerical_guidance,John Murphy,We continue to expect organic revenue growth of approximately 7% to 8%,Management expects 2022 organic revenue growth of approximately 7% to 8%.,2022,2022-12-31,partially_verified,autochecker,"Using Compustat total revenue (revtq) as the available proxy for the organic revenue claim, post-call 2022 Q2-Q4 revenue totaled $32,513M versus $29,635M for the same quarters of 2021 from the base period. That is realized growth of about 9.7%. The claim was for approximately 7% to 8% growth, so the direction is correct and the result is fairly close, but it is above the guided range by more than a ~10% relative tolerance versus the midpoint."
KO_20220425_e2caf0c5,The Coca-Cola Company,KO,2022-04-25,Q1 2022,numerical_guidance,John Murphy,comparable currency-neutral earnings per share guidance of 8% to 10% growth versus 2021,Management expects 2022 comparable currency-neutral earnings per share growth of 8% to 10% versus 2021.,2022,2022-12-31,not_yet_resolvable,autochecker,"The post-call Compustat rows provide 2022 Q2-Q4 EPS: diluted EPS ex-items totals 0.4 + 0.6 + 0.5 = 1.5, and basic EPS ex-items also totals 1.5. However, the claim is for full-year 2022 EPS growth versus full-year 2021. To compute that realised percentage, the full-year 2021 EPS baseline is needed, including 2021 Q1, which is not present in the provided panel. Therefore the full-year growth rate in the claim's units cannot be resolved from the supplied Compustat rows."
KO_20220425_3c4996d2,The Coca-Cola Company,KO,2022-04-25,Q1 2022,numerical_guidance,John Murphy,we now expect an effective tax rate of 19.5% in 2022,Management expects an effective tax rate of 19.5% in 2022.,2022,2022-12-31,verified,autochecker,"For the post-call quarters within the 2022 horizon, effective tax rate = total tax expense / total pretax income = (384 + 622 + 444) / (2284 + 3444 + 2500) = 1450 / 8228 = 17.6%. Management claimed 19.5% for 2022. The realised post-call rate is about 1.9 percentage points lower, or roughly 9.6% below the claim on a relative basis, which is within the ~10% tolerance for magnitude claims."
KO_20220425_8d54dddf,The Coca-Cola Company,KO,2022-04-25,Q1 2022,numerical_guidance,John Murphy,we continue to expect comparable earnings per share growth of 5% to 6% versus 2021,Management expects comparable earnings per share growth of 5% to 6% versus 2021.,2022,2022-12-31,not_yet_resolvable,autochecker,"The claim is for full-year 2022 EPS growth of 5% to 6% versus full-year 2021. The post-call diluted EPS values available are Q2 2022 = 0.4, Q3 2022 = 0.6, and Q4 2022 = 0.5, summing to 1.5 for the post-call portion. However, to compute the stated full-year growth versus 2021, the panel would also need the full-year 2021 EPS baseline, including Q1 2021, which is not provided. Therefore the realised full-year percentage growth cannot be computed from the supplied panel."
KO_20220425_ba7ad080,The Coca-Cola Company,KO,2022-04-25,Q1 2022,numerical_guidance,John Murphy,we continue to expect to generate approximately $10.5 billion of free cash flow for 2022,Management expects to generate approximately $10.5 billion of free cash flow for 2022.,2022,2022-12-31,verified,autochecker,"Free cash flow is computed as operating cash flow minus capital expenditures. For full-year 2022, realised operating cash flow was 623 + 3923 + 3522 + 2950 = $11.018 billion, and realised capex was 217 + 270 + 289 + 708 = $1.484 billion. Realised free cash flow was therefore $9.534 billion. Management claimed approximately $10.5 billion, so actual FCF was $0.966 billion lower, about 9.2% below the claim. This is within the roughly 10% tolerance for an approximate magnitude claim."
KO_20220425_86c9c20a,The Coca-Cola Company,KO,2022-04-25,Q1 2022,numerical_guidance,John Murphy,approximately $12 billion in cash from operations,Management expects approximately $12 billion in cash from operations for 2022.,2022,2022-12-31,verified,autochecker,"Management guided to approximately $12.0 billion of cash from operations for full-year 2022. The post-call quarters generated $3.923B + $3.522B + $2.950B = $10.395B; including the already reported 2022 Q1 operating cash flow of $0.623B, full-year 2022 cash from operations was $11.018B. That is $0.982B, or about 8.2%, below the $12.0B claim, within the ~10% tolerance for an approximate magnitude."
KO_20220726_606fe90b,The Coca-Cola Company,KO,2022-07-26,Q2 2022,capital_allocation,John Murphy,approximately $1.5 billion in capital investments,Management expects approximately $1.5 billion in capital investments in 2022.,2022,2022-12-31,verified,autochecker,"Using quarterly capital expenditures as the proxy for capital investments, realised FY2022 capital investments were 217 + 270 + 289 + 708 = $1,484 million, or about $1.48 billion. This is very close to management's approximately $1.5 billion expectation, differing by only $16 million, about 1.1% below the claim."
KO_20220726_08ba60f5,The Coca-Cola Company,KO,2022-07-26,Q2 2022,numerical_guidance,John Murphy,We now expect organic revenue growth of 12% to 13%,Management expects organic revenue growth of 12% to 13% for full year 2022.,full year 2022,2022-12-31,contradicted,autochecker,"Using Compustat reported revenue (revtq, same values as saleq here) as the available proxy for organic revenue, the post-call quarters totaled $21,188M in Q3+Q4 2022 versus $19,506M in Q3+Q4 2021. That is realized growth of (21,188 / 19,506 - 1) = 8.6%. Management guided to 12%-13% organic revenue growth for FY2022. The available reported-revenue growth is positive, but it is materially below the guided range by about 3.4 to 4.4 percentage points, more than a 25% relative shortfall versus the guided magnitude. Compustat does not isolate organic revenue, so this comparison uses reported revenue as the proxy."
KO_20220726_1b50c14b,The Coca-Cola Company,KO,2022-07-26,Q2 2022,numerical_guidance,John Murphy,comparable currency-neutral earnings per share growth of 14% to 15% versus 2021,Management expects comparable currency-neutral earnings per share growth of 14% to 15% for full year 2022.,full year 2022,2022-12-31,not_yet_resolvable,autochecker,"The post-call Compustat panel provides diluted EPS for 2022 Q3 and Q4 of $0.60 and $0.50, respectively, for a post-call total of $1.10. However, the claim is for full-year 2022 comparable currency-neutral EPS growth versus full-year 2021. The panel does not provide comparable currency-neutral EPS, and it also lacks the full 2021 baseline needed to compute full-year growth. Therefore the realised 14%-15% comparable currency-neutral EPS growth cannot be computed from the supplied Compustat data."
KO_20220726_4603abbb,The Coca-Cola Company,KO,2022-07-26,Q2 2022,numerical_guidance,John Murphy,we continue to expect comparable earnings per share growth of 5% to 6% versus 2021,Management expects comparable earnings per share growth of 5% to 6% for full year 2022.,full year 2022,2022-12-31,not_yet_resolvable,autochecker,"The claim is for full-year 2022 comparable EPS growth of 5% to 6% versus full-year 2021. The post-call EPS values available are Q3 2022 = 0.6 and Q4 2022 = 0.5, and the panel also shows pre-call 2022 Q1 = 0.6 and Q2 = 0.4, implying reported diluted EPS for 2022 of 2.1. However, the table does not include 2021 Q1 and Q2 EPS, so full-year 2021 EPS cannot be calculated from the provided panel. Without the full-year 2021 baseline, the realised 2022 growth rate versus 2021 cannot be computed."
